Course ID,Title,Description
1037,Praktische Einführung in Deep Learning für Computer Vision,"Über “Neuronale Netze”, “Artificial Intelligence” und “Deep Learning” reden heute alle. Jeder möchte künstliche Intelligenz nutzen, doch wie fange ich am besten damit an?
In diesem Kurs werden wir künstliche neuronale Netze, die Grundlage künstlicher Intelligenz, sowohl theoretisch als auch praktisch einführen. Dabei wollen wir genauer untersuchen, wie solche Netze funktionieren und wie man sie entwickeln und einsetzen kann. Der Kurs beinhaltet theoretische Grundlagen, praktische Übungen und weiterführende Exkurse, unter anderem in die Algorithmen, welche zum Trainieren von neuronalen Netzen verwendet werden. Anschließend werden wir lernen, wie ein Netz für verschiedene Einsatzzwecke optimiert werden kann und wie wir auch mit wenig Trainingsdaten Erfolge erzielen können. Am Ende zeigen wir, wie ihr selbst ein gutes Netz für ein eigenes Problem trainieren könnt.
Ziel des Kurses ist es, ein Verständnis von künstlichen neuronalen Netzen und deren Einsatz- und Optimierungsmöglichkeiten zu schaffen."
1038,Objektorientierte Programmierung in Java,"In diesem openHPI Einsteigerkurs beschäftigen wir uns mit den Grundlagen der objektorientierten Programmierung und lösen gemeinsam mit Detektiv Duke einen mysteriösen Entführungsfall. Wesentliches Merkmal der objektorientierten Programmierung ist die geeignete Verteilung von Aufgaben auf Komponenten, die jeweils eigene Eigenschaften und Verhaltensweisen aufweisen und sich gegenseitig beeinflussen können.
Durch regelmäßige Programmieraufgaben wird das Gelernte angewendet und die Teilnehmer erwerben praktische Kenntnisse in der Programmiersprache Java.
Voraussetzungen für diesen Kurs sind lediglich ein Interesse an Programmierung, ein Computer mit Internetzugang und ein moderner Browser. Vorhergehende Programmiererfahrung ist hilfreich, aber nicht notwendig. Um erfolgreich am Kurs teilzunehmen, sollte man 4-6 Stunden Zeit pro Woche einplanen."
1039,Object-Oriented Programming in Java,"In this free online course, you’ll learn the key concepts of object-oriented programming (OOP) as well as fundamental programming techniques. You’ll apply your newly acquired knowledge by implementing hands-on programming exercises in the Java programming language. The course will be completed by an exercise to model a small, object-oriented, real-world scenario. After completing this course, you’ll be able to model and implement small programs in Java and apply OOP best practices.
This course is operated by the openHPI team on openSAP, the sister platform of openHPI."
1040,Data Engineering und Data Science – Klarheit in den Schlagwort-Dschungel,"Die Schlagwörter Künstliche Intelligenz, Data Science, Data Engineering, und Big Data dominieren seit einigen Jahren nicht nur die IT-Schlagzeilen. In unserem Kurs wollen wir diese Wörter mit grundlegendem Inhalt füllen und die typischen Arbeitsschritte eines Data Scientists nachvollziehen. Insbesondere schauen wir hinter die Kulissen und betrachten den oft mühsamen Weg der Daten bis sie endlich genutzt werden können um z.B. mittels maschinellem Lernen Modelle trainieren zu können. Dazu gehören die Datenbeschaffung, die Datenreinigung, und die Datenintegration. Anschließend lernen wir, wie man aus diesen Daten und auch aus Texten neue Erkenntnisse mittels Data Mining und maschinellem Lernen gewinnt. Der Abschluss bildet eine Diskussion über Ethik und Fairness bei der automatisierten Datenanalyse."
1041,"Trolle, Hass und Fake-News: Wie können wir das Internet retten?","In diesem Kurs wollen wir uns verschiedenen Phänomenen von Missbrauch und Fehlverhalten von Nutzer/innen im Web widmen. Neben der Einordnung und Kategorisierung dieser Phänomene wollen wir uns auch mit (technischen) Lösungen befassen, die Trolle und Fake News erkennen oder vor Hate Speech warnen. Des Weiteren wollen wir diskutieren, inwieweit jede/r Einzelne das Web besser machen kann und wie sich jede/r selbst gegen negative Auswirkungen insbesondere von sozialen Medien schützen kann.
Die zeitliche Aufteilung ist dabei wie folgt: Zuerst geben wir einen Überblick über die aktuellen Probleme und versuchen relevante Aspekte zu identifizieren sowie grundlegende Begriffe zu definieren. Weitere Schwerpunkte in der ersten Woche werden dann Trolle und Hate Speech sein. In Woche zwei beschäftigen wir uns mit Informationen im Zeitalter von sozialen Medien: Vor- und Nachteile, Fake News bis hin zu Propaganda."
1042,"Die Technologie, die die Welt veränderte - 50 Jahre Internet","Das Internet, das 1969, im selben Jahr wie die erste Mondlandung und das legendäre Woodstock-Festival, aus der Vernetzung von gerade einmal vier Computern in Kalifornien hervorging, hat sich in 50 Jahren zu einer einmaligen, weltumspannenden Infrastruktur entwickelt.
Mehr als die Hälfte der Erdbevölkerung ist durch das Internet vernetzt. Die revolutionäre Form der Übermittlung jeglicher Art von Daten zwischen Orten dieser Erde ließ das Netz der Netze zum unverzichtbaren Rückgrat der Gesellschaften werden. Die Nutzerzahlen explodierten auf inzwischen vier Milliarden Menschen (davon 57 Millionen in Deutschland), eine Innovation jagte die nächste.
Das Tempo des dramatischen Wandels, den das Internet hervorrief und noch immer antreibt, ist enorm und für manchen atemberaubend. Viele bekannte und noch mehr unbekannte Persönlichkeiten prägten die Entwicklung des Internets. Doch die spannende Erfolgsgeschichte zeigt auch, dass es Schattenseiten der Entwicklung gibt. Was ist aus der ursprünglichen Hoffnung auf eine Demokratisierung der Kommunikation geworden? Inwieweit hat das Internet Zugang zu besseren Bildungschancen ermöglicht? Wie nutzen große Internet-Konzerne und Regierungen das Netz der Netze? Wie gläsern ist der durchs Internet vernetzte Mensch, wie sicher kann er über dieses Netzwerk kommunizieren? Was machen wir Menschen mit dem Internet und was macht das Internet mit uns? Befindet sich das 50 Jahre alte Internet in einer Art Midlife Crisis, steht es angesichts von immer mehr manipulierten Inhalten an einem Wendepunkt? Wie abhängig sind wir mittlerweile von dieser Technologie und wie geht es mit ihr weiter?
Solche und ähnliche Fragen versucht unser openHPI-Kurs mit Ihnen zusammen zu beantworten und zu diskutieren. Nehmen Sie außerdem Teil an unserer großen Mitmachaktion ""Internet 100 - wie das Internet im Jahr 2069 aussieht""."
1043,Netzwerkvirtualisierung - Von einfach bis zur Cloud,"Nach der Virtualisierung der Server wird nun das Netzwerk virtualisiert. Physikalische und virtuelle Netzwerke werden entkoppelt und somit entstehen Netze mit neuen Möglichkeiten.
Der Kurs zeigt die Netzwerkvirtualisierung, die schon lange im Netzwerk Verwendung findet, bis hin zu Cloud Netzwerken und Unternehmensvernetzung mit Hilfe von SD-WAN. Praktische Hinweise im Kurs machen eine erste Planung und Einführung von virtuellen Netzwerken in Unternehmen, Behörden und Bildungseinrichtungen möglich. Neben neuen Netzwerkstrukturen, die zur Verfügung stehen, helfen virtuelle Netzwerke auch bei der Einführung von IPv6. Hier knüpft der Kurs an den IPv6 Kurs von Herrn Boeddinghaus an."
1044,Human-Centered Design: Building and Testing Prototypes,"Learn to build simple but effective prototypes, prepare testing scenarios and gain valuable feedback from potential users. This course introduces you to the basics of prototyping, planning and running real testing scenarios."
1045,Startup Talks at HPI,"Meet the founders of DesignStudio, Flixbus, GetYourGuide and GoEuro as well as Berlin’s leading startup lawyer and seed investor. Over the course of two semesters the event series “Startup Talks@HPI” will feature startup experts and founders such as Paul Stafford, Christoph Maire, André Eggert, Jochen Engert, Johannes Reck and Naren Shaam.
The speakers will give advice about making a startup a success. They will discuss entrepreneurial topics such as ideation, business and legal fundamentals, product development, marketing, sales, funding and growth. The lecture series will provide first-hand information from speakers belonging to the inner circle of the German and European startup scene.
Unlike the other openHPI courses, Startup Talks is a pure lecture series (without exam and certificate)."
1046,"Business Processes: Modeling, Simulation, Execution","Business process models play a central role in analyzing, simulating, and executing business processes. They serve as a communication vehicle for professionals with different background and expertise, ranging from business administration, quality management, and organizational development to systems architectures, and software development.
This online course introduces concepts of business process modeling and decision modeling using the industry standards Business Process Model and Notation, BPMN, and Decision Model and Notation, DMN. The course also covers concepts to describe and analyze business processes and decisions, and to simulate and execute them using modern BPM tools."
1047,Beyond Brockhaus Thinking: With Design Thinking to a Networked Culture,"Design Thinking is an innovation approach, which evolved through the past 12 years from a university program at Stanford and HPI Potsdam to a globally respected and universally applied set of methods and tools for supporting and driving change towards a networked culture in organizations. The course is an introduction to the core principles of Design Thinking, explains its cultural impact and inspires to actively use Design Thinking at the organizational level.
The course is valuable for decision makers, who want to get an idea about the strategic underpinnings of design thinking. They will learn the terminology and get a better understanding, why and how to use Design Thinking to make the transformation towards a networked organization.
The course is not a substitute for a real design thinking-workshop, which will give - at its best - the deep and diverse team experience in a creative environment to the participants. But it helps, to get a better understanding of the core concepts behind Design Thinking and supports the development of their transformational strategy."
1048,Future of Computing - IBM POWER9 and beyond,"Digitalization and exponential growth of data are challenges to the world of traditional IT. In this course we are presenting technologies that are building blocks for the “Future of Computing”.
The Systems of Engagement with unstructured data and analytical processing require new approaches for software development and deployment, like microservices, containerization and cloud-native applications. In addition, IT departments require new underlying technologies to enable processing of vast amounts of data: Hardware Acceleration, Artificial Intelligence and Blockchain Technology.
These new trends are put in contrast with essential technologies of the traditional Systems of Record. Reliability, High-Availability and Serviceability in these systems require sophisticated hardware, operating systems and middleware in order to process transactions at scale."
1049,Blockchain - Sicherheit auch ohne Trust Center,"Wussten Sie, dass das Konzept der Blockchain aus dem Jahr 2008 stammt und letztlich eine Reaktion auf die zweifelhafte Rolle der Banken war, die sich in der Welt-Finanzkrise gezeigt hat? Während etwa beim Online-Banking ein Finanzdienstleister für akkurate Buchführung über alle Transaktionen sorgt und die Konten für die Kunden führt, zeigte das 2009 online gegangene Netzwerk der Kryptowährung Bitcoin erstmals, dass man auch ohne Bank ein sicheres Währungssystem betreiben kann - eben dank der Blockchain-Technologie.
Mit einem weiteren zweiwöchigen Onlinekurs (unser Blockchain-Kurs aus dem Jahr 2018) zur viel diskutierten Blockchain-Technologie wollen wir einen tieferen und gleichzeitig kompakten Einblick in die grundlegenden Konzepte und die Herausforderungen komplexer verteilter Systeme geben. Im Unterschied zu den weit verbreiteten zentralisierten Systemen mit einer Vertrauensinstanz im Mittelpunkt, geht es Blockchain-Technologien darum, verlässlichen und sicheren Datenaustausch auch ohne eine solche zentrale Instanz zu gewährleisten.
Darauf, wie in einem solchen verteilten System ohne zentrale Instanz Vertrauen und Konsens zwischen den einzelnen Akteuren geschaffen werden kann, geht der kostenlose openHPI-Kompaktkurs im Detail ein. Er richtet sich an Anfänger, die sich für das Thema Blockchain interessieren und gerne intensiver in die Materie einsteigen wollen.
Mit diesem Wissen ausgestattet, werden Sie ein tieferes Verständnis der Blockchain-Technologie bekommen und entscheidende Unterschiede zu bestehenden Ansätzen verstehen."
1050,Wie programmiere ich meinen ersten Mini-Computer?,"In immer mehr Geräten stecken Computer: Von A wie Auto bis hin zu Z wie Zahnbürste. Doch das heißt nicht, dass da gleich ein ganzer PC verbaut ist. Meist ist ein kleiner Chip das Gehirn, welches die Funktionen des Gerätes ermöglicht, ein so genannter Mikrocontroller. Einer der berühmtesten Vertreter ist der ""Arduino"", aber es gibt noch viele mehr. In diesem Kurs zeigen wir dir, wie du einen solchen Mikrocontroller programmieren kannst. Mit diesem Wissen ausgestattet werden wir kleine Projekte umsetzen, z.B. ein Auto fernsteuern oder eine Pflanzenüberwachung für deinen Balkon bauen."
1051,Patentrecht: So schützen Sie Ihre Innovation,"Haben Sie eine kreative Idee im Kopf oder bereits einen ersten Prototypen entwickelt? Dann wird es höchste Zeit, sich über den Schutz der Erfindung und eine Patentierung Gedanken zu machen.
In diesem 3-wöchigen Kurs zeigen wir Ihnen, welche Schutzrechte es gibt und welche Vorteile ein Patent bietet. Dabei möchten wir insbesondere das Urheberrecht vom Patentrecht abgrenzen. Wir werden darauf eingehen, wem typischerweise eine Software-Entwicklung gehört und warum es sinnvoll sein könnte, ein Patent darauf anzumelden. Außerdem erfahren Sie, was dabei zu beachten ist und wie die übliche Vorgehensweise aussieht. Zuletzt werden wir auf Open Source Software zu sprechen kommen und diskutieren, welche Parallelen zwischen Patenten und Open Source bestehen."
1052,Digitale Identitäten - Wer bin ich im Netz?,"Der durchschnittliche Internetnutzer verfügt über mehr als 25 Internetkonten, die für unterschiedlichste Absichten angelegt werden. Neben Accounts für E-Mail-Dienste oder soziale Netzwerke, benötigen Nutzer Zugang zu Lernplattformen oder Onlineshoppingdiensten. Jedes dieser Internetkonten repräsentiert eine individuelle Digitale Identität. Jede dieser Identitäten umfasst wiederum unterschiedlichste persönliche Angaben. Neben Informationen, die zur Authentifizierung eines Users genutzt werden, wie einer E-Mail-Adresse und einem Passwort, benötigen andere Dienste sehr persönliche und sensible Daten, wie die Bankverbindung zum Bezahlen und den Wohnort für die anschließende Lieferung einer Bestellung."
1053,Datensicherheit im Netz – Einführung in die Informationssicherheit,"Eine Nachricht im Internet wird auf ihrem Weg bis zum Zielsystem durch mehrere Netze und über unterschiedliche Stationen geschickt. Die einzelnen Stationen sind dafür verantwortlich, dass die Nachricht ordnungsgemäß weitergeleitet und schließlich dem korrekten Empfänger zugestellt wird. Jede dieser Stationen kann die Nachricht, falls sie im Klartext verschickt wird, empfangen und den Inhalt lesen. Somit kann ein potenzieller Angreifer, falls er eines dieser Zwischensysteme kontrolliert, den Inhalt der Nachricht ebenfalls lesen und sogar vor dem Weitersenden verändern. Solche Angriffe können extreme Auswirkungen auf die Kommunikation haben.
Im Rahmen dieses Kurses werden wir beleuchten, wie und ob ihre Verbindung zum Online-Banking sicher oder der Inhalt einer E-Mail vertrauenswürdig ist. Dafür werden wir uns mit Grundlagen der Kryptographie, Sicherheitszielen und verschiedenen Arten der Verschlüsselung beschäftigen. Darüber hinaus wird es Einblicke in unterschiedliche Modelle und Standards, die in der Praxis verwendet werden, geben."
1054,Mainframe - Crucial Role in Modern Enterprise Computing,"Whether you withdraw money at a cashpoint, pay with a credit card, book a flight or buy a train ticket—mainframes are always at work in the background. They do the crucial work and ensure that everything runs securely and without data loss. More than 70 percent of the Global 500s work with mainframes.
The digital transformation poses a big challenge for enterprises today, and the modern mainframe plays a crucial role in addressing this challenge. As the typical platform for the ""systems of record"" of most large organizations, its unique features support today's requirements regarding performance, flexibility and security and enable companies to successfully manage the challenges of an online world. This course will give an overview of the modern mainframe, its concepts and features and their role in enterprise computing. Topics addressed range from mainframe architecture, hardware and operating systems (z/OS, z/VM, Linux), Mainframe application development and transaction processing to state-of-the-art workloads such as blockchain and analytics. In addition, industry success stories will be presented."
1055,Programmieren mit Ruby,"Die Programmiersprache Ruby hat sich nicht zuletzt durch den Erfolg des Web-Frameworks Ruby on Rails einen Namen gemacht. Ihre Anwendungsmöglichkeiten gehen aber weit über das Web hinaus; und wer Rails kennt, kennt noch lange nicht alles, was diese Sprache zu bieten hat.
In diesem Kurs wollen wir mit euch Ruby von Grund auf kennenlernen - mit seiner Eleganz und seiner Ausdrucksstärke, aber auch mit seinen Tücken."
1056,Human-Centered Design: From Synthesis to Creative Ideas,"Make sense of design research data, learn to frame a problem from a user's perspective, and generate lots of new ideas: This course will introduce you to the basics of design synthesis and brainstorming techniques."
1057,Einführung in die Mathematik der Algorithmik,"In allen Anwendungen in der Informatik steckt eine große Portion Mathematik. Insbesondere basieren viele Algorithmen, die uns täglich helfen (zum Beispiel Googles Suchalgorithmen oder Routenfindung bei Navigationssytemen) auf cleveren mathematische Einsichten.
In diesem Kurs wird die Sprache der modernen Mathematik vorgestellt. In der ersten Woche werden wir dazu die grundlegenden Bausteine einführen; dabei wird es um Quantoren und Junktoren, sowie Formalisierungen und Spezifikationen gehen. In der zweiten Woche werden wir diese Themen anhand ausgewählter Beispiele (Wegfindung und Googles PageRank Algorithmus) anwenden. In der dritten Woche steigen wir dann etwas tiefer in die Mathematik und lernen mehrere Analysewerkzeuge kennen (z.B. die berühmte ""O-Notation"")
Für diesen Kurs ist kein akademisches Vorwissen aus der Mathematik nötig. Teilnehmer des Kurses verstehen im Anschluss die mathematische Sprache und verstehen, wie diese bei algorithmischen Fragestellungen angewandt wird."
1058,Java Capstone Series Pt. 1,"The Java Capstone Series is a completely new course format.
Fewer videos and more hands-on activities.
Together, we will develop small Java projects from scratch to transform knowledge into competencies.
For the first iteration we will develop a little game, e.g. Pong or BreakOut.
The idea is to work on these projects in teams, but if you prefer you can also work alone. This format is completely new for us as well. We see ourselves rather as co-learners and facilitators than as teachers.
Until the course will officially start in mid-September, we have prepared a short survey consisting of basically just one question: What do you expect from this course? Topics, approaches, tools, tasks,..."
1059,Blockchain: Hype oder Innovation?,"Das Thema Blockchain polarisiert und hat sich in letzter Zeit zu einem Medienhype entwickelt. So sehen viele die Blockchain-Technologie entweder als eine Allzweckwaffe, zu der aber nur wenige einen Zugang haben, oder als eine Hacker-Technologie für geheime Geschäfte im Darknet. Dadurch sind diejenigen, die sich für das Thema interessieren, gezwungen sich für oder gegen die Blockchain-Technologie zu entscheiden. Dabei liegt die Innovation der Blockchain-Technologie in ihrer erfolgreichen Zusammensetzung bereits vorhandener Ansätze: dezentrale Netzwerke, Kryptographie und Konsensfindungsalgorithmen.
Im Rahmen des Kurses werden wir Ihnen helfen, Ihren eigenen Standpunkt zur Blockchain-Technologie zu finden und aufzeigen welche Eigenschaften wirklich innovativ und welche nichts weiter als ein Hype sind."
1060,IPv6 in modernen Netzwerken,"Jedes Gerät, das ans Internet angeschlossen ist, besitzt eine eigene IP-Adresse, über die es angesprochen werden kann. Dies wird beispielsweise dann nötig, wenn eine E-Mail von einem Absender zum Empfänger übermittelt werden soll. Der Empfänger kann mithilfe der IP-Adresse eindeutig identifiziert werden, ähnlich wie mit einer Postanschrift.
Mit der rasanten Verbreitung des Internets reichen die anfangs geschaffenen Adressen, genannt IPv4, nicht mehr aus. Um den Mangel an IP-Adressen zu beheben, hat die Internet Engineering Task Force (IETF) ein neues Internetprotokoll entwickelt, welches wir Ihnen in diesem Kurs vorstellen wollen. Sie erfahren, was hinter IPv6 steckt und wie es schrittweise in die Netzwerke eingeführt wird."
1061,Information Service Engineering,"The information available today exceeds all limits. Access to this abundance of data is only possible via search engines and sophisticated information processing applications. To enable the transition from raw data to well-structured knowledge, technologies such as natural language processing, information retrieval, and data and knowledge mining must be applied. In this MOOC, you will learn the fundamentals of natural language processing as well as the basics of Linked Data-based knowledge representation and machine learning to enable the transition from unstructured data to machine processable knowledge."
1062,IT-Recht für Software-Entwickler,"Sie sind Software-Ingenieur, Gründer oder Unternehmer eines IT-Unternehmens. Ihnen begegnen verschiedene rechtliche Themen. Die wichtigsten aus den Bereichen Verträge, Urheberrechte, Markenrecht, Patentrechte, Datenschutz, aber auch einige Bezüge zu Fragen bei Unternehmensverkäufen werden Ihnen in diesem 4-wöchigen Kurs von zwei anerkannten spezialisierten Rechtsanwälten auf diesem Gebiet nähergebracht.
Sie werden SaaS-, Kauf- und Entwicklungsverträge kennenlernen, aber auch erfahren, was man dokumentieren sollte, um die Rechte an seinem Code zu sichern. Wir möchten Sie in dem Kurs dafür sensibilisieren, Verträge aus dem Internet mit Vorsicht zu nutzen, da je nach Geschäftsmodell und handelnder Person (Unternehmen, Verbraucher) unterschiedliche Verträge notwendig werden."
1063,Internet Security for Beginners,"Hackers manage again and again to steal passwords, to access sensitive enterprise and user data, and, in the worst case scenario, to even paralyze entire companies. The Internet offers various possibilities to its users, but, at the same time, it harbors dangers and vulnerable points of attack, which many people are not even aware of. In this openHPI course you will learn the basics of Internet security. Why is the Internet insecure by nature of its design? What are the weak spots of the Internet and how are they exploited by cybercriminals? We want to answer these questions and a lot more in this course. Additionally, we will advise you on how to protect yourself from such cyberattacks."
1064,Linux für Alle,"In diesem Onlinekurs möchten wir Ihnen Linux vorstellen, ein Open Source Betriebssystem. Im täglichen Leben begegnet uns Linux häufig dort wo es vielen Menschen gar nicht wirklich bewusst ist: So laufen beispielsweise viele Webserver unter Linux, übrigens auch der openHPI-Server, Android baut auf Linux auf und auch als Spieleplattform ist Linux beliebt.
Man kann Linux aber auch auf nahezu jedem Desktop PC oder Laptop als ein kostenloses, alternatives Betriebssystem zu Windows nutzen.
Wir zeigen Ihnen Schritt für Schritt, wie Sie Linux bei sich installieren, konfigurieren und Programme benutzen können.
Der Umstieg auf das neue System ist unproblematisch.
Die üblichen Anwendungen wie Internet-Browser, E-Mail-Programme, Videoplayer oder Office-Programme sind auch unter Linux zu finden.
In praktischen Übungen können Sie das erworbene Wissen gleich anwenden."
