Course ID,Title,Description
1096,Sicher per E-Mail kommunizieren - Mitleser unerwünscht,"Die E-Mail ist eines der wichtigsten Kommunikationsmittel unserer Zeit. Dennoch lässt die Technologie hinsichtlich der Sicherheit deutlich zu wünschen übrig. E-Mail-Nutzer/innen können sich weder sicher sein, dass niemand die Nachrichten mitliest, noch dass diese auch unverändert bei den Empfänger/innen ankommen. Um geeignete Sicherheitsmaßnahmen - die sogenannte Ende-zu-Ende-Verschlüsselung sowie digitale Signaturen - müssen sich alle Nutzer/innen selbst kümmern.
In diesem openHPI-Workshop lernen Sie auch anhand praktischer Übungen, wie Sie mit dem Einsatz kostenloser Werkzeuge verschlüsselte und digital unterschriebene E-Mails versenden und empfangen können."
1097,Introduction to Successful Remote Teamwork,"Tele-working is becoming a more and more popular topic amongst modern organizations.
However, it also comes with some challenges for both: tele-workers and management.
This course will make you and your team fit for virtual collaboration in geographically distributed contexts. You will learn about the benefits and risks of driving a virtual team culture and how guided remote work drives to success. Furthermore, you will learn how to use intercultural competences as a key factor of interaction and communication. In the hands-on part of the course you will learn how to select appropriate online collaboration tools and how to employ them in a practical task. Working with a “real life” virtual team, you will gain first-hand experience about the opportunities and challenges of tele-working."
1098,openHPI Forum 2020 - Lessons Learned about Digital Education in Times of Crisis,"Wie ein Brennglas hat die weltweite Coronavirus-Pandemie offengelegt, was in der Online-Bildung schon funktioniert und was noch nicht. Wer schnell etwas für die eigene und die öffentliche Gesundheit tun wollte, belegte Onlinekurse, zum Beispiel der Weltgesundheitsorganisation WHO. Und Beschäftigte, die ihr Arbeitspensum reduzieren mussten oder den Job gar ganz verloren, setzen nun ihre Hoffnung auf virtuelle IT-Lernangebote, um ihr Berufsleben zukunftssicher zu machen. Ganz zu schweigen von Lehrkräften, Jugendlichen und Eltern, welche mittlerweile – mehr oder weniger unfreiwillig - Experten für digitalen Schulunterricht in der Cloud geworden sind.
Im diesjährigen openHPI-Forum, welches erstmals virtuell stattfindet, möchten wir mit Ihnen diskutieren, wie Covid-19 sich auf unterschiedliche Bereiche ausgewirkt hat und erörtern, was mögliche Langzeitfolgen, was nur kurze Trends sind. Seien Sie dabei!
English version below"
1099,Cybersecurity Basics - Prüfung,"Wenn Sie die drei Sicherheits-Workshops absolviert haben, die letztes Jahr auf openHPI angeboten wurden, sollten Sie nun bestens über die Basics der Cybersecurity Bescheid wissen. Hier bieten wir Ihnen die Möglichkeit, eine Prüfung über den Stoff aus allen drei Workshops abzulegen. Bei Erfolg erhalten Sie ein Zeugnis oder ein qualifiziertes Zertifikat, welches üblicherweise nur in 6-Wochen-Kursen vergeben wird.
Eine Einschreibung für die Prüfung ist erst möglich, wenn die Voraussetzungen für die Teilnahme erfüllt sind. Folgende Kriterien müssen erfüllt sein:
Teilnahme an den 3 Sicherheits-Workshops (Datensicherheit im Netz, Digitale Identitäten, Blockchain - Sicherheit auch ohne Trust Center)
Jeweils Erwerb der Teilnahmebestätigung (Zugriff auf mind. 80% der Lernmaterialien)
Die Teilnahme an den Wochentests in den einzelnen Kursen ist für diese Prüfung irrelevant."
1100,HPI Academy: Strategic Design Thinking For Every Day - Summer 2021,"This is an online course for everyone who wants to use Strategic Design Thinking for everyday challenges. You learn to use the whole potential of the approach, going beyond the method and the tools. Equip yourself with the most impactful Design Thinking principles to unlock your innovation capacity in complex, highly constrained situations.
Register now for the upcoming course starting April 23, 2021. Registration closes April 16, 2021.
This online training experience is provided by the HPI Academy."
